{
 "axis_labels": [
  11,
  10.5,
  10,
  9.5,
  9,
  8.5,
  8,
  7.5,
  7,
  6.5,
  6,
  5.5,
  5,
  4.5,
  4,
  3.5,
  3,
  2.5,
  2,
  1.5,
  1,
  0.5,
  0,
  -0.5,
  -1
 ],
 "title_lines": [
  "YX-ENB-TEMP-129-sto-PhCCBuCl-Chloramphenicol-2",
  "YX-ENB-TEMP-129-sto-PhCCBuCl-Chloramphenicol-2",
  "3at-2",
  "1H NMR (400 MHz, CDCl3)"
 ],
 "compound_number": "3at-2",
 "frequency_text": "400 MHz",
 "solvent_text": "CDCl3",
 "structure_drawn": true,
 "structure_location": "top-left",
 "integral_values": [
  1.96,
  2.05,
  1.96,
  3.03,
  0.95,
  0.95,
  0.98,
  0.97,
  1.01,
  1,
  1,
  2.02,
  1,
  4.06
 ],
 "integral_style": "brackets below baseline",
 "peak_labels_printed": true,
 "annotations": [],
 "insets": [],
 "vertical_intensity_axis": false,
 "image_kind": "software screenshot",
 "legibility": "fair",
 "trace_color": "dark red",
 "notes": "Axis labels at the edges are cut off. The leftmost one shows only \".0\" (read as 11.0) and the rightmost shows \"-1\" (read as -1.0). The notebook-code header is printed twice, top-left, and runs over the first few peak labels near 8.1-7.5 ppm, so those labels can't be read; only \"...2.56\"-like fragments and the 7.43 to 7.14 labels are clear. The peak labels I can read are 7.43, 7.43, 7.42, 7.41, 7.40, 7.39, 7.38, 7.36, 7.34, 7.33, 7.32, 7.17, 7.14, 5.82, 5.27, 4.37, 4.34, 4.33, 4.32, 4.31, 4.11, 4.11, 4.09, 4.08, 3.78, 3.77, 3.75, 3.74, 3.65, 3.64, 3.62, 3.41, 3.41, 2.05, 2.04, 2.04. The integrals are rotated blue numbers with green bracket marks below the baseline. No integrals are printed for the peaks at about 7.26, 1.6 or 1.25 ppm. Text in the image: the 1 in 1H is superscript and the 3 in CDCl3 is subscript. There are no text annotations on the spectrum and no insets."
}