{
 "axis_labels": [
  12,
  11.5,
  11,
  10.5,
  10,
  9.5,
  9,
  8.5,
  8,
  7.5,
  7,
  6.5,
  6,
  5.5,
  5,
  4.5,
  4,
  3.5,
  3,
  2.5,
  2,
  1.5,
  1,
  0.5,
  0,
  -0.5,
  -1,
  -1.5
 ],
 "title_lines": [],
 "compound_number": "",
 "frequency_text": "",
 "solvent_text": "",
 "structure_drawn": true,
 "structure_location": "top-left",
 "integral_values": [
  2,
  5.04,
  2.11,
  1,
  2.07,
  1.03,
  1.09
 ],
 "integral_style": "brackets below baseline",
 "peak_labels_printed": true,
 "annotations": [],
 "insets": [],
 "vertical_intensity_axis": false,
 "image_kind": "software screenshot",
 "legibility": "fair",
 "trace_color": "dark red / maroon (about RGB 128,0,0); picked peak tops are marked in blue",
 "notes": "The image edges cut off the first and last x-axis labels. The leftmost is visible only as \"2.0\" but sits one step left of 11.5, so it is 12.0. The rightmost is visible only as \"-1\" but sits one step right of -1.0, so it is presumably -1.5. The x-axis title reads \"f1 (ppm)\". There is no header, title, compound number, frequency or solvent text. The structure is drawn at upper left: a Ph-C≡C-CH(SCF3)-CH(4-bromophenyl)-CH=CH2 skeleton with wedge and hash stereobonds. Integrals are green brackets below the baseline with rotated blue values. From left to right they are 2.00, 5.04 and 2.11 (overlapping, about 7.5-7.2 ppm), 1.00 (about 6.3), 2.07 (about 5.35), 1.03 (about 4.48) and 1.09 (about 3.79). Blue peak-pick labels across the top were read as: 7.50, 7.49, 7.48, 7.43, 7.41, 7.40, 7.40, 7.39, 7.39, 7.38, 7.38, 7.37, 7.36, 7.34, 7.34, 7.33, 7.31, 7.31, 7.30, 7.29, 7.25, 7.23; 6.31, 6.29, 6.28, 6.27, 6.26, 6.24; 5.38, 5.35, 5.32, 5.30, 5.28; 4.48, 4.47; 3.80, 3.79, 3.78, 3.77. The 6.24 and 5.38 labels overlap, so some digits are uncertain at this resolution. Several drawn signals have no integral, peak label or text annotation: tall peaks near 1.56 and 1.26 ppm, a small cluster near 0.88 ppm, a small peak near 0.07 ppm, and small peaks near 7.05 and 6.9 ppm."
}