{
 "axis_labels": [
  11,
  10.5,
  10,
  9.5,
  9,
  8.5,
  8,
  7.5,
  7,
  6.5,
  6,
  5.5,
  5,
  4.5,
  4,
  3.5,
  3,
  2.5,
  2,
  1.5,
  1,
  0.5,
  0,
  -0.5,
  -1
 ],
 "title_lines": [
  "ymw-II-189A-col-bip"
 ],
 "compound_number": "",
 "frequency_text": "",
 "solvent_text": "",
 "structure_drawn": false,
 "structure_location": "none",
 "integral_values": [
  4.06,
  2.07,
  3.03,
  0.96,
  0.98,
  1.01,
  1.98,
  0.99,
  2.94
 ],
 "integral_style": "brackets below baseline",
 "peak_labels_printed": true,
 "annotations": [],
 "insets": [],
 "vertical_intensity_axis": false,
 "image_kind": "software screenshot",
 "legibility": "fair",
 "trace_color": "dark red / maroon",
 "notes": "Title is the notebook code only, top-left inside the plot frame; its last character is clipped at the text box edge (reads \"ymw-II-189A-col-bip\" followed by a partial glyph). The x-axis title is \"f1 (ppm)\". The rightmost axis label is clipped at the image edge (\"-1.(\") and is taken as -1.0. Integrals are green brackets below the baseline, with blue values printed rotated 90 degrees. Approximate positions: 4.06 (~7.60), 2.07 (~7.45), 3.03 (~7.33), 0.96 (~3.04), 0.98 (~2.45), 1.01 (~2.25), 1.98 (~2.05), 0.99 (~1.61), 2.94 (~1.18). Uncertain readings: the 1.61 ppm integral could be 0.98 or 0.99 (best read 0.99, last digit partly covered by the leader line), and the first aromatic integral could be 4.00 or 4.06 (best read 4.06). Peak labels are printed in blue across the top: 7.60, 7.60, 7.59, 7.55, 7.54, 7.45, 7.44, 7.43, 7.35, 7.34, 7.32, 7.32, 7.30; 3.06, 3.04, 3.03, 3.01; 2.25, 2.24, 2.08, 2.06, 2.04, 2.03; 1.62, 1.61, 1.59 (overlapping a 1.19), 1.18. The multiplet at ~2.45 ppm has no peak label of its own that I could see. Small blue peak-pick markers sit on the peak tops. Small unlabeled peaks appear at about 1.55 ppm and 1.9 ppm, with no text annotations. No frequency, solvent, structure, inset or vertical intensity axis is printed."
}