{
 "axis_labels": [
  10,
  9.5,
  9,
  8.5,
  8,
  7.5,
  7,
  6.5,
  6,
  5.5,
  5,
  4.5,
  4,
  3.5,
  3,
  2.5,
  2,
  1.5,
  1,
  0.5,
  0,
  -0.5,
  -1
 ],
 "title_lines": [
  "acd-141.12-p1bB",
  "acd-141.12-p1bB",
  "Spectrum S133: 1H NMR of 22b."
 ],
 "compound_number": "22b",
 "frequency_text": "",
 "solvent_text": "",
 "structure_drawn": true,
 "structure_location": "top-center",
 "integral_values": [
  1.81,
  1.85,
  2.02,
  2.01,
  2.11,
  1.88,
  2.87,
  3.34,
  2.83,
  6
 ],
 "integral_style": "brackets below baseline",
 "peak_labels_printed": true,
 "annotations": [],
 "insets": [],
 "vertical_intensity_axis": false,
 "image_kind": "software screenshot",
 "legibility": "fair",
 "trace_color": "black",
 "notes": "Header line \"acd-141.12-p1bB\" is printed twice at top-left (notebook/sample code). Caption below plot reads \"Spectrum S133: 1H NMR of 22b.\" with superscript 1 and bold 22b. x-axis title \"f1 (ppm)\". Peak labels printed in blue above peaks: 7.71, 7.69, 7.39, 7.38, 7.33, 7.32, 7.30, 7.29, 7.23, 7.22, 7.20, 7.19 (aromatic cluster; the last few are crowded and read at low confidence), 3.21, 2.45, 2.40, 1.17. Integrals are rotated blue values under bracket-style integral marks: 1.81 (~7.70), then a grouped set 1.85, 2.02, 2.01, 2.11, 1.88 (~7.4-7.2), 2.87 (~3.21), 3.34 and 2.83 (~2.45 and ~2.40), 6.00 (~1.17). Unlabeled, unintegrated peaks are visible at ~1.55 (tall), ~1.25, ~1.85, ~2.1-2.2, ~0.9, ~0.07 and ~7.26 (very tall, extends to top of plot); no text annotations name them. No frequency or solvent text printed. Structure (colored: blue lactam/NTs, green alkene/N-CH3, red Br) drawn at top-center of plot."
}