{
 "axis_labels": [
  11,
  10.5,
  10,
  9.5,
  9,
  8.5,
  8,
  7.5,
  7,
  6.5,
  6,
  5.5,
  5,
  4.5,
  4,
  3.5,
  3,
  2.5,
  2,
  1.5,
  1,
  0.5,
  0,
  -0.5,
  -1
 ],
 "title_lines": [
  "ymw-III-217C-c"
 ],
 "compound_number": "",
 "frequency_text": "",
 "solvent_text": "",
 "structure_drawn": false,
 "structure_location": "none",
 "integral_values": [
  1.92,
  1.9,
  1,
  1.01,
  2.03,
  2.05,
  0.92,
  3.06,
  1.07,
  4.05,
  1.15,
  2.99,
  3.16
 ],
 "integral_style": "brackets below baseline",
 "peak_labels_printed": true,
 "annotations": [],
 "insets": [],
 "vertical_intensity_axis": false,
 "image_kind": "software screenshot",
 "legibility": "fair",
 "trace_color": "dark red / maroon (approx RGB 164,72,72)",
 "notes": "Only header text is the notebook/sample code \"ymw-III-217C-c\" at top-left; no compound number, frequency, solvent or structure printed. X-axis titled \"f1 (ppm)\"; the rightmost axis label is clipped at the image edge (reads \"-1.(\" , taken as -1.0). Integrals are green brackets below the baseline with blue rotated values; they are printed as 1.92, 1.90, 1.00, 1.01, 2.03, 2.05, 0.92, 3.06, 1.07, 4.05, 1.15, 2.99, 3.16 (the \"2.99\" is partly overlapped by its bracket tick and could conceivably be 2.98). Peak ppm labels printed along the top: 7.31, 7.29, 7.23, 7.21; 5.51, 5.51, 5.50, 5.50, 5.50, 5.49, 5.47, 5.43, 5.41, 5.41, 5.40, 5.40, 5.39, 5.39, 5.38, 5.36; 4.52 (overlaps the 5.36 label); 3.52, 3.50, 3.48; 3.03, 3.01, 2.99, 2.97; 2.41, 2.39; 2.11, 2.09, 2.08, 2.02; 1.62, 1.59; 1.17, 1.16; 1.02, 1.00, 0.98. Blue peak-pick tick marks appear at the peak tops. No text annotations naming signals (solvent, impurity, etc.) on the spectrum. Small unlabeled baseline bumps are visible near ~6.3, ~4.9, ~1.3 and ~0.3 ppm."
}