{
 "axis_labels": [
  9.5,
  9,
  8.5,
  8,
  7.5,
  7,
  6.5,
  6,
  5.5,
  5,
  4.5,
  4,
  3.5,
  3,
  2.5,
  2,
  1.5,
  1,
  0.5,
  0,
  -0.5,
  -1
 ],
 "title_lines": [],
 "compound_number": "",
 "frequency_text": "",
 "solvent_text": "",
 "structure_drawn": true,
 "structure_location": "middle-left",
 "integral_values": [
  0.95,
  0.95,
  1,
  1.05,
  1.01,
  2.12,
  8.74,
  5.74
 ],
 "integral_style": "brackets below baseline",
 "peak_labels_printed": true,
 "annotations": [],
 "insets": [],
 "vertical_intensity_axis": false,
 "image_kind": "software screenshot",
 "legibility": "fair",
 "trace_color": "black",
 "notes": "No title, compound number, frequency or solvent text is printed anywhere. Leftmost major axis tick (would be 10.0) has no printed label; first printed label is 9.5. Peak labels printed above peaks, left to right: 3.74, 3.73, 3.72, 3.71, 3.71, 3.70, 3.69, 3.68, 3.09, 3.08, 2.92, 2.91, 2.90, 2.89, 2.42, 2.40, 2.39, 2.38, 2.37, 0.72, 0.02, -0.00. The labels \"2.37\" and \"0.72\" overlap and are partly drawn on top of each other. The two tall singlets near 4.77 and 4.23 ppm have no ppm labels. A small unlabeled peak sits near 7.08 ppm, and there are small unlabeled bumps near 1.0-1.2 and 0.6-0.7 ppm and just right of 0 ppm. Integral values are printed rotated 90 degrees under the baseline, above the axis. Drawn structure: a fused bicyclic lactam (pyrrolizidinone-type) with N, a C=O, an iodo substituent (wedge I), an OTBS group labeled \"TBSO\", and a bridging lactone (O=C-O). There is no inset, and no text annotation names any signal."
}