{
 "axis_labels": [
  11,
  10.5,
  10,
  9.5,
  9,
  8.5,
  8,
  7.5,
  7,
  6.5,
  6,
  5.5,
  5,
  4.5,
  4,
  3.5,
  3,
  2.5,
  2,
  1.5,
  1,
  0.5,
  0,
  -0.5,
  -1
 ],
 "title_lines": [
  "(No impurity)",
  "NCB-7-181-1H"
 ],
 "compound_number": "",
 "frequency_text": "",
 "solvent_text": "",
 "structure_drawn": false,
 "structure_location": "none",
 "integral_values": [
  0.98,
  2,
  0.96,
  1.01,
  1,
  2.16,
  2.25,
  2.27,
  2.18,
  2.15
 ],
 "integral_style": "brackets below baseline",
 "peak_labels_printed": true,
 "annotations": [
  {
   "text": "EtOAc",
   "approx_ppm": 4.11
  },
  {
   "text": "EtOAc",
   "approx_ppm": 2.06
  },
  {
   "text": "EtOAc",
   "approx_ppm": 1.26
  }
 ],
 "insets": [],
 "vertical_intensity_axis": false,
 "image_kind": "software screenshot",
 "legibility": "fair",
 "trace_color": "dark red (maroon)",
 "notes": "Image is 850x585. Axis: the leftmost label is cut off at the image edge and shows as \"1.0\" (11.0 by the 0.5-ppm spacing). The rightmost shows as \"-1\" (-1.0). Ticks are at x=3 (11.0) and x=846 (-1.0), about 70.25 px/ppm. Header: the top line is cropped at the image edge, so only the lower half of the glyphs shows. It reads most likely as \"(No impurity)\" (centered above the plot), but this is uncertain. The second line, \"NCB-7-181-1H\" at top-left, is a notebook/sample code, not a compound number. No frequency, solvent or structure is printed. Integrals are green bracket marks under the baseline, with blue values rotated 90 degrees. Their positions: 0.98 (~7.45), 2.00 (~7.27-7.20), 0.96 (~7.17), 1.01 (~6.65), 1.00 (~6.08), 2.16 (~3.62), 2.25 (~3.51), 2.27 (~3.23), 2.18 (~2.44), 2.15 (~1.98). Printed peak labels, left to right: 7.45, 7.44, 7.43, 7.43, 7.27, 7.24, 7.24, 7.23, 7.22, 7.22, 7.21, 7.21, 7.20, 7.19, 7.17, 7.17, 7.16, 7.16; 6.67, 6.64; 6.11, 6.10, 6.09, 6.08, 6.07, 6.06; 3.63, 3.61, 3.60, 3.52, 3.51, 3.51, 3.49; 3.25, 3.23, 3.22; 2.44, 2.44, 2.43, 2.42 (overprinted by \"2.00\"); 2.00, 1.99, 1.98, 1.96, 1.95. The second \"EtOAc\" label (~2.06 ppm) runs into the 1.99 multiplet, so its final \"c\" is partly hidden. Small peaks with no label or integral show at about 5.30, 3.75, 2.70, 1.56, 0.9 and 0.88 ppm. There are no insets."
}