{
 "axis_labels": [
  10,
  9.5,
  9,
  8.5,
  8,
  7.5,
  7,
  6.5,
  6,
  5.5,
  5,
  4.5,
  4,
  3.5,
  3,
  2.5,
  2,
  1.5,
  1,
  0.5,
  0,
  -0.5,
  -1
 ],
 "title_lines": [
  "SGS-6-24 H",
  "3da",
  "1H NMR",
  "500 MHz, CDCl3"
 ],
 "compound_number": "3da",
 "frequency_text": "500 MHz",
 "solvent_text": "CDCl3",
 "structure_drawn": true,
 "structure_location": "middle-left",
 "integral_values": [
  5.61,
  0.83,
  0.11,
  2,
  0.86,
  0.12,
  0.15,
  0.83,
  1,
  0.96,
  0.16,
  0.86,
  7.45,
  5.65
 ],
 "integral_style": "brackets below baseline",
 "peak_labels_printed": true,
 "annotations": [],
 "insets": [],
 "vertical_intensity_axis": false,
 "image_kind": "software screenshot",
 "legibility": "good",
 "trace_color": "black",
 "notes": "The leftmost and rightmost x-axis labels are cut off at the image edges. Only \"0.0\" shows at the left and \"-1\" at the right; they were read as 10.0 and -1.0 from the 0.5 ppm spacing. The x-axis title is \"f1 (ppm)\". \"SGS-6-24 H\" is printed at the top left. The structure is drawn on the left side, between the top and the middle, above the \"3da\" / 1H NMR / 500 MHz, CDCl3 caption. It is a 3-(1-phenylallyl)succinimide with an N-cyclohexyl group, and the cyclohexyl ring is drawn in red. Integrals are green brackets below the baseline, with values printed in blue and rotated 90 degrees. Green peak-pick labels are printed above the peaks in groups: 7.34-7.14, 2.69-1.12 (top row), 6.15-5.93, 5.27-5.12, 4.12-3.76 and 3.25-3.17. Several of these labels overlap and are hard to read: \"6.13\", \"5.95/5.93\", \"3.76\" and the rightmost \"1.12\", which is cut off at the right edge. No text annotations such as solvent or impurity names are placed on the spectrum. Two unlabeled features are visible: a tall unannotated singlet near 1.7 ppm, and a small peak near 0.0 ppm. There is no inset."
}