{
 "axis_labels": [
  10,
  9.5,
  9,
  8.5,
  8,
  7.5,
  7,
  6.5,
  6,
  5.5,
  5,
  4.5,
  4,
  3.5,
  3,
  2.5,
  2,
  1.5,
  1,
  0.5,
  0,
  -0.5,
  -1
 ],
 "title_lines": [
  "SGS-6-76 (minor) H",
  "5ah",
  "1H NMR",
  "500 MHz, CDCl3"
 ],
 "compound_number": "5ah",
 "frequency_text": "500 MHz",
 "solvent_text": "CDCl3",
 "structure_drawn": true,
 "structure_location": "top-left",
 "integral_values": [
  2.12,
  2.08,
  2.24,
  3.18,
  1.11,
  1.03,
  1,
  1,
  0.99,
  0.99,
  1.04,
  1.06,
  2.22,
  4.1,
  3.27,
  4.43,
  5.15,
  7.45
 ],
 "integral_style": "brackets below baseline",
 "peak_labels_printed": true,
 "annotations": [],
 "insets": [],
 "vertical_intensity_axis": false,
 "image_kind": "software screenshot",
 "legibility": "fair",
 "trace_color": "black",
 "notes": "Image is 1066x727. The first and last axis labels are clipped at the image edges: the far-left label shows only \"0.0\" (the leading \"1\" of \"10.0\" is cut off), and the far-right label shows only \"-1\" (most likely \"-1.0\", also cut off). The x-axis caption reads \"f1 (ppm)\". The header \"SGS-6-76 (minor) H\" sits at the top left and overlaps the first green peak labels. The caption under the structure reads \"5ah\" in bold, then \"1H NMR\" with a superscript 1, then \"500 MHz, CDCl3\" with a subscript 3. The structure is drawn top-left of centre: an N,N-dipropyl sulfonamide aryl ester of a methoxyphenyl group, with a vinyl group, Ph, and a CH2C(O)-oxazolidinone. Integral values are printed in blue, rotated vertically, under green integral brackets below the baseline. Green ppm peak labels are printed above the peaks in groups: 8.27/8.25, 7.91/7.89, 7.17 to 6.54, 6.14 to 6.07, 5.24 to 5.14, 4.34 to 3.09 (a top row running across the plot), 1.60 to 1.52, and 0.89/0.88/0.86. No text annotations name any signal (no solvent, H2O or grease labels). There are no insets. Small unlabeled peaks are visible near 2.05, 2.15 and 0.07 ppm, a tall singlet near 1.26 and a tall singlet near 3.66, but none of these carries a text label."
}